{
  "$schema": "https://json-schema.org/draft/2020-12/schema",
  "$id": "https://github.com/latent-sre/sre-agents/schemas/evidence-envelope-v1.schema.json",
  "title": "SRE Agents evidence envelope v1",
  "description": "Portable result evidence. scripts/evidence_envelope.py additionally rejects recursively secret-bearing field names and credential-shaped argv entries.",
  "type": "object",
  "additionalProperties": false,
  "required": [
    "schema_version",
    "evidence_id",
    "producer",
    "context",
    "target",
    "criterion",
    "status",
    "started_at",
    "ended_at",
    "command",
    "source",
    "environment",
    "isolation",
    "artifacts",
    "limitations"
  ],
  "properties": {
    "schema_version": { "const": 1 },
    "evidence_id": { "type": "string", "pattern": "^ev_[0-9a-f]{32}$" },
    "producer": {
      "type": "object",
      "additionalProperties": false,
      "required": ["name", "role"],
      "properties": {
        "name": { "type": "string", "minLength": 1 },
        "role": { "type": "string", "minLength": 1 }
      }
    },
    "context": {
      "type": "object",
      "additionalProperties": false,
      "required": ["run_id", "task_id", "attempt_id"],
      "properties": {
        "run_id": { "$ref": "#/$defs/context_id" },
        "task_id": { "$ref": "#/$defs/context_id" },
        "attempt_id": { "$ref": "#/$defs/context_id" }
      }
    },
    "target": {
      "type": "object",
      "additionalProperties": false,
      "required": ["root", "revision", "tree_digest"],
      "properties": {
        "root": { "type": "string", "minLength": 1 },
        "revision": { "type": "string", "minLength": 1 },
        "tree_digest": {
          "oneOf": [
            { "type": "null" },
            { "type": "string", "pattern": "^[0-9a-f]{64}$" }
          ]
        }
      }
    },
    "criterion": { "type": "string", "minLength": 1 },
    "status": { "enum": ["pass", "fail", "skip", "inconclusive"] },
    "started_at": {
      "type": "string",
      "format": "date-time",
      "pattern": "^\\d{4}-\\d{2}-\\d{2}T\\d{2}:\\d{2}:\\d{2}(?:\\.\\d+)?Z$"
    },
    "ended_at": {
      "type": "string",
      "format": "date-time",
      "pattern": "^\\d{4}-\\d{2}-\\d{2}T\\d{2}:\\d{2}:\\d{2}(?:\\.\\d+)?Z$"
    },
    "command": {
      "oneOf": [
        { "type": "null" },
        {
          "type": "object",
          "additionalProperties": false,
          "required": ["argv", "cwd", "exit_code"],
          "properties": {
            "argv": {
              "type": "array",
              "minItems": 1,
              "items": { "type": "string", "minLength": 1 }
            },
            "cwd": { "type": "string", "minLength": 1 },
            "exit_code": { "type": ["integer", "null"] }
          }
        }
      ]
    },
    "source": { "type": ["object", "null"] },
    "environment": { "type": "object" },
    "isolation": { "type": "object" },
    "artifacts": {
      "type": "array",
      "items": {
        "type": "object",
        "additionalProperties": false,
        "required": ["path", "sha256", "size"],
        "properties": {
          "path": { "type": "string", "minLength": 1 },
          "sha256": { "type": "string", "pattern": "^[0-9a-f]{64}$" },
          "size": { "type": "integer", "minimum": 0 }
        }
      }
    },
    "limitations": {
      "type": "array",
      "items": { "type": "string", "minLength": 1 }
    }
  },
  "$defs": {
    "context_id": {
      "oneOf": [
        { "type": "null" },
        { "type": "string", "pattern": "^[A-Za-z0-9][A-Za-z0-9._:-]{0,127}$" }
      ]
    }
  }
}
