{
  "schema_version": 1,
  "evidence_id": "ev_221ca3aa10654fffaf933af2c53ebeb1",
  "producer": {
    "name": "hawkins",
    "role": "human VS Code probe operator"
  },
  "context": {
    "run_id": "host-002-20260824-075430",
    "task_id": "HOST-002",
    "attempt_id": "attempt-1"
  },
  "target": {
    "root": "F:\\repos\\sre-agents-host-002",
    "revision": "4eae26d1534d4274774e0f404ee728989b61e688",
    "tree_digest": "e53ce0e6b45b1dc79fb6c12ff944df2da853f570bfd2994ed9d4989e37d35ec2"
  },
  "criterion": "Inventory every top-level tool offered to observability-engineer and compare the defaults with the generated adapter.",
  "status": "pass",
  "started_at": "2026-08-24T08:05:40Z",
  "ended_at": "2026-08-24T08:11:37Z",
  "command": null,
  "source": {
    "kind": "human_ui_observation",
    "step": "Step 2 - observability-engineer tool inventory",
    "vscode_version": "1.134.0",
    "vscode_commit": "110a328ea54b42367b803ec53ee0bf52ef26b419",
    "observed_outcome": "The picker showed 29 Selected. agent, edit, execute, read, and search were enabled; browser, todo, vscode, and web were offered but disabled. This matches the generated adapter and exposes the probe table's stale execute-omission expectation."
  },
  "environment": {
    "os": "Microsoft Windows 11 Pro 10.0.26200 build 26200",
    "architecture": "x64"
  },
  "isolation": {
    "workspace": "local clean checkout and disposable VS Code user-data directory",
    "network": "GitHub sign-in only; no chat prompt submitted",
    "live_systems_touched": "GitHub authentication for the disposable Copilot profile only; no production system"
  },
  "artifacts": [
    {
      "path": "docs/reviews/evidence/host-002/2026-08-24-transcript.md",
      "sha256": "d991c5c98f39cb60fec55c83c8c032aaf1e9b2886f12b71d45c7d6f472d0e112",
      "size": 14351
    }
  ],
  "limitations": [
    "The observation tests the current picker defaults, not whether a managed policy can enforce those defaults."
  ]
}
