{
  "schema_version": 1,
  "evidence_id": "ev_a0198a2a8f404b74ae69ef36a3d7116e",
  "producer": {
    "name": "hawkins",
    "role": "human-authorized Codex-driven VS Code probe operator"
  },
  "context": {
    "run_id": "host-002-20260830-vscode-plugin-delegation",
    "task_id": "HOST-002",
    "attempt_id": "real-plugin-software-engineer-reviewer"
  },
  "target": {
    "root": "F:\\repos\\sre-agents\\.worktrees\\vscode-copilot-beta-readiness",
    "revision": "0c6c4dc24c5fa88f3927dc33ba6609d23c54ba33",
    "tree_digest": "5fa582179e4ac5c91c4636cc1a1ae60d76e8cd59aec863d761abaaba58bf2d6f"
  },
  "criterion": "The plugin-provided software-engineer invokes the agent tool with agentName reviewer and returns a result attributed to the plugin-provided reviewer.",
  "status": "fail",
  "started_at": "2026-08-30T15:30:00Z",
  "ended_at": "2026-08-30T15:31:59Z",
  "command": null,
  "source": {
    "kind": "human_ui_observation",
    "ui_driver": "Codex computer use under explicit human authorization",
    "step": "Step 4 - prove one real allowed plugin edge",
    "vscode_version": "1.135.0",
    "vscode_commit": "08d4889f9ec4a1685d257b9b95de036c8e1ce1e5",
    "observed_outcome": "With plugin software-engineer selected, the first response emitted parent-authored handoff/review prose and no agent tool call. The single stronger retry emitted no tool call and returned exactly: Cannot invoke the reviewer tool here: no `agent` tool is available in this environment. No reviewer child attribution or result was produced."
  },
  "environment": {
    "os": "Microsoft Windows 11 Pro build 26200",
    "architecture": "x64"
  },
  "isolation": {
    "workspace": "neutral workspace and disposable VS Code user-data/extensions directories",
    "network": "two authenticated GitHub Copilot model requests; no repository fetch or production traffic",
    "live_systems_touched": "none"
  },
  "artifacts": [
    {
      "path": "docs/reviews/evidence/host-002/2026-08-30-vscode-plugin-delegation-transcript.md",
      "sha256": "0f8f331bd5ef0408e8db1b1ee34c4895ea511bbf088d5b53f989302893942494",
      "size": 9476
    },
    {
      "path": "docs/probes/fixtures/host-002-agent-delegation/.github/agents/host002-allowed.agent.md",
      "sha256": "ac04e42e23204b64191d1fc5346e75d2841eb09d184c1486202db9ad2411b131",
      "size": 227
    },
    {
      "path": "docs/probes/fixtures/host-002-agent-delegation/.github/agents/host002-coordinator.agent.md",
      "sha256": "63e19a58f8574265001b56e3b5cba6ae1d02991d3cd9a321e1da36333f839f15",
      "size": 450
    },
    {
      "path": "docs/probes/fixtures/host-002-agent-delegation/.github/agents/host002-forbidden.agent.md",
      "sha256": "04b80313b981e16aa587ad2111096ae6875fb8c439b4b6e20a5842c260a384e3",
      "size": 232
    }
  ],
  "limitations": [
    "The allowed-edge retry used stronger wording instead of the documented identical prompt; the deviation is preserved in the transcript.",
    "The observation establishes the runtime symptom but does not isolate whether its root cause is plugin-agent tool exposure, selection state, model behavior, or another host path.",
    "No third model request was submitted."
  ]
}
