{
  "schema_version": 1,
  "evidence_id": "ev_6983ba15e45443d791faec4bbda91b46",
  "producer": {
    "name": "hawkins",
    "role": "human VS Code probe operator"
  },
  "context": {
    "run_id": "host-002-20260825-000410",
    "task_id": "HOST-002",
    "attempt_id": "attempt-2"
  },
  "target": {
    "root": "F:\\repos\\sre-agents-host-002",
    "revision": "463fcd56cf0017374a60228bf4530d67007bb84a",
    "tree_digest": "ab0bc37a68b07f65167c0e72b5b0f5d26dceb07d4e790fc4739f86d8b8abdc12"
  },
  "criterion": "Determine whether the built-in Agent execute selection remains enabled after switching to sre without changing the generated file, active editor buffer, repository, or inspected settings.",
  "status": "inconclusive",
  "started_at": "2026-08-25T05:04:10Z",
  "ended_at": "2026-08-25T05:09:38Z",
  "command": null,
  "source": {
    "kind": "human_ui_observation",
    "step": "Step 4 - corrected default/global override and agent switch reprobe",
    "vscode_version": "1.134.0",
    "vscode_commit": "110a328ea54b42367b803ec53ee0bf52ef26b419",
    "observed_outcome": "The built-in Agent picker called its selection global, showed 52 Selected, and already had execute checked. After switching to sre in the same new Chat session, the sre picker showed its generated 14 Selected set with execute offered but unchecked and warned that changes would be applied to the custom-agent file. The generated editor stayed clean and disk, Git, and settings metadata stayed at baseline. This is a measured negative for the tested override path. No command was submitted because execute did not remain enabled, so invocation authority remains inconclusive."
  },
  "environment": {
    "os": "Microsoft Windows 11 Pro build 26200",
    "architecture": "x64"
  },
  "isolation": {
    "workspace": "local clean normal clone and disposable VS Code user-data directory",
    "network": "GitHub sign-in only; no chat prompt submitted",
    "live_systems_touched": "none"
  },
  "artifacts": [
    {
      "path": "docs/reviews/evidence/host-002/2026-08-25-invocation-reprobe-transcript.md",
      "sha256": "9a26ea478216e62daa51a61e804b8bc21ac885f646c6512bcaa092274acb8c3a",
      "size": 4768
    }
  ],
  "limitations": [
    "No tool call or host denial was observed because execute did not remain enabled after the switch to sre.",
    "The 2026-08-24 run on the same build observed a different configuration outcome; picker history and profile-state differences were not isolated.",
    "Prompt-file precedence, deep links, managed settings, hook identity, other builds, and other invocation paths were not tested."
  ]
}
