{
  "schema_version": 1,
  "evidence_id": "ev_437402c185cd49f39e53bdf1080c63f4",
  "producer": {
    "name": "hawkins",
    "role": "human VS Code probe operator"
  },
  "context": {
    "run_id": "host-002-20260824-075430",
    "task_id": "HOST-002",
    "attempt_id": "attempt-1"
  },
  "target": {
    "root": "F:\\repos\\sre-agents-host-002",
    "revision": "4eae26d1534d4274774e0f404ee728989b61e688",
    "tree_digest": "e53ce0e6b45b1dc79fb6c12ff944df2da853f570bfd2994ed9d4989e37d35ec2"
  },
  "criterion": "Toggle one declared sre tool, observe persistence, restore the initial state, and prove final cleanup.",
  "status": "pass",
  "started_at": "2026-08-24T08:12:18Z",
  "ended_at": "2026-08-24T08:19:01Z",
  "command": null,
  "source": {
    "kind": "human_ui_observation",
    "step": "Step 3 - picker persistence and cleanup",
    "vscode_version": "1.134.0",
    "vscode_commit": "110a328ea54b42367b803ec53ee0bf52ef26b419",
    "observed_outcome": "Disabling sre read persisted after reopening: 7 Selected with only nested readFile checked. No inspected on-disk file changed. The initial state was restored to 14 Selected; final file digests, clean Git status, and Gate A 6/6 matched the baseline. A later step proved the original instrument omitted active editor-buffer state."
  },
  "environment": {
    "os": "Microsoft Windows 11 Pro 10.0.26200 build 26200",
    "architecture": "x64"
  },
  "isolation": {
    "workspace": "local clean checkout and disposable VS Code user-data directory",
    "network": "GitHub sign-in only; no chat prompt submitted",
    "live_systems_touched": "GitHub authentication for the disposable Copilot profile only; no production system"
  },
  "artifacts": [
    {
      "path": "docs/reviews/evidence/host-002/2026-08-24-transcript.md",
      "sha256": "d991c5c98f39cb60fec55c83c8c032aaf1e9b2886f12b71d45c7d6f472d0e112",
      "size": 14351
    }
  ],
  "limitations": [
    "The declared-tool toggle's exact non-disk persistence store was not identified because VS Code internal state can contain authentication material and was not inspected."
  ]
}
